{
 "schema": "drivedit.route/1",
 "route_id": "golden_s_curve_v1",
 "map_id": "arland",
 "split": "train",
 "nav_version": "nav_v1",
 "lane_side": "right",
 "closed": false,
 "polyline": [
  [
   1000.0,
   30.0,
   3000.0
  ],
  [
   1000.0,
   30.0,
   3001.0
  ],
  [
   1000.0,
   30.0,
   3002.0
  ],
  [
   1000.0,
   30.0,
   3003.0
  ],
  [
   1000.0,
   30.0,
   3004.0
  ],
  [
   1000.01,
   30.0,
   3004.4999
  ],
  [
   1000.03,
   30.0,
   3004.9995
  ],
  [
   1000.06,
   30.0,
   3005.4986
  ],
  [
   1000.0999,
   30.0,
   3005.997
  ],
  [
   1000.1499,
   30.0,
   3006.4945
  ],
  [
   1000.2097,
   30.0,
   3006.9909
  ],
  [
   1000.2795,
   30.0,
   3007.486
  ],
  [
   1000.3591,
   30.0,
   3007.9796
  ],
  [
   1000.4487,
   30.0,
   3008.4716
  ],
  [
   1000.548,
   30.0,
   3008.9616
  ],
  [
   1000.6571,
   30.0,
   3009.4495
  ],
  [
   1000.776,
   30.0,
   3009.9352
  ],
  [
   1000.9045,
   30.0,
   3010.4184
  ],
  [
   1001.0427,
   30.0,
   3010.8989
  ],
  [
   1001.1904,
   30.0,
   3011.3766
  ],
  [
   1001.3477,
   30.0,
   3011.8512
  ],
  [
   1001.5145,
   30.0,
   3012.3226
  ],
  [
   1001.6906,
   30.0,
   3012.7905
  ],
  [
   1001.8761,
   30.0,
   3013.2549
  ],
  [
   1002.0708,
   30.0,
   3013.7154
  ],
  [
   1002.2746,
   30.0,
   3014.1719
  ],
  [
   1002.4876,
   30.0,
   3014.6243
  ],
  [
   1002.7096,
   30.0,
   3015.0723
  ],
  [
   1002.9405,
   30.0,
   3015.5158
  ],
  [
   1003.1802,
   30.0,
   3015.9546
  ],
  [
   1003.4286,
   30.0,
   3016.3885
  ],
  [
   1003.6857,
   30.0,
   3016.8174
  ],
  [
   1003.9513,
   30.0,
   3017.241
  ],
  [
   1004.2253,
   30.0,
   3017.6593
  ],
  [
   1004.5076,
   30.0,
   3018.0719
  ],
  [
   1004.7981,
   30.0,
   3018.4789
  ],
  [
   1005.0967,
   30.0,
   3018.8799
  ],
  [
   1005.4033,
   30.0,
   3019.2749
  ],
  [
   1005.7177,
   30.0,
   3019.6637
  ],
  [
   1006.0398,
   30.0,
   3020.0461
  ],
  [
   1006.3695,
   30.0,
   3020.422
  ],
  [
   1006.7066,
   30.0,
   3020.7913
  ],
  [
   1007.0511,
   30.0,
   3021.1537
  ],
  [
   1007.4027,
   30.0,
   3021.5091
  ],
  [
   1007.7614,
   30.0,
   3021.8575
  ],
  [
   1008.127,
   30.0,
   3022.1986
  ],
  [
   1008.4993,
   30.0,
   3022.5323
  ],
  [
   1008.8782,
   30.0,
   3022.8585
  ],
  [
   1009.2636,
   30.0,
   3023.1771
  ],
  [
   1009.6425,
   30.0,
   3023.5033
  ],
  [
   1010.0148,
   30.0,
   3023.8371
  ],
  [
   1010.3804,
   30.0,
   3024.1782
  ],
  [
   1010.7391,
   30.0,
   3024.5265
  ],
  [
   1011.0907,
   30.0,
   3024.882
  ],
  [
   1011.4352,
   30.0,
   3025.2444
  ],
  [
   1011.7723,
   30.0,
   3025.6136
  ],
  [
   1012.102,
   30.0,
   3025.9895
  ],
  [
   1012.4241,
   30.0,
   3026.372
  ],
  [
   1012.7385,
   30.0,
   3026.7608
  ],
  [
   1013.0451,
   30.0,
   3027.1557
  ],
  [
   1013.3437,
   30.0,
   3027.5568
  ],
  [
   1013.6342,
   30.0,
   3027.9637
  ],
  [
   1013.9165,
   30.0,
   3028.3764
  ],
  [
   1014.1905,
   30.0,
   3028.7946
  ],
  [
   1014.4561,
   30.0,
   3029.2183
  ],
  [
   1014.7132,
   30.0,
   3029.6471
  ],
  [
   1014.9616,
   30.0,
   3030.081
  ],
  [
   1015.2014,
   30.0,
   3030.5198
  ],
  [
   1015.4323,
   30.0,
   3030.9633
  ],
  [
   1015.6542,
   30.0,
   3031.4113
  ],
  [
   1015.8672,
   30.0,
   3031.8637
  ],
  [
   1016.0711,
   30.0,
   3032.3203
  ],
  [
   1016.2658,
   30.0,
   3032.7808
  ],
  [
   1016.4512,
   30.0,
   3033.2451
  ],
  [
   1016.6274,
   30.0,
   3033.7131
  ],
  [
   1016.7941,
   30.0,
   3034.1844
  ],
  [
   1016.9514,
   30.0,
   3034.6591
  ],
  [
   1017.0992,
   30.0,
   3035.1367
  ],
  [
   1017.2373,
   30.0,
   3035.6173
  ],
  [
   1017.3659,
   30.0,
   3036.1005
  ],
  [
   1017.4847,
   30.0,
   3036.5861
  ],
  [
   1017.5939,
   30.0,
   3037.0741
  ],
  [
   1017.6932,
   30.0,
   3037.5641
  ],
  [
   1017.7827,
   30.0,
   3038.056
  ],
  [
   1017.8624,
   30.0,
   3038.5496
  ],
  [
   1017.9321,
   30.0,
   3039.0448
  ],
  [
   1017.992,
   30.0,
   3039.5412
  ],
  [
   1018.0419,
   30.0,
   3040.0387
  ],
  [
   1018.0819,
   30.0,
   3040.5371
  ],
  [
   1018.1118,
   30.0,
   3041.0362
  ],
  [
   1018.1318,
   30.0,
   3041.5358
  ],
  [
   1018.1418,
   30.0,
   3042.0357
  ],
  [
   1018.1418,
   30.0,
   3042.5357
  ],
  [
   1018.1418,
   30.0,
   3043.0357
  ],
  [
   1018.1418,
   30.0,
   3043.5357
  ],
  [
   1018.1418,
   30.0,
   3044.0357
  ],
  [
   1018.1418,
   30.0,
   3044.5357
  ],
  [
   1018.1418,
   30.0,
   3045.0357
  ],
  [
   1018.1418,
   30.0,
   3045.5357
  ],
  [
   1018.1418,
   30.0,
   3046.0357
  ],
  [
   1018.1418,
   30.0,
   3046.5357
  ],
  [
   1018.1418,
   30.0,
   3047.0357
  ],
  [
   1018.1418,
   30.0,
   3047.5357
  ],
  [
   1018.1418,
   30.0,
   3048.0357
  ],
  [
   1018.1418,
   30.0,
   3048.5357
  ],
  [
   1018.1418,
   30.0,
   3049.0357
  ],
  [
   1018.1418,
   30.0,
   3049.5357
  ],
  [
   1018.1418,
   30.0,
   3050.0357
  ],
  [
   1018.1418,
   30.0,
   3050.5357
  ],
  [
   1018.1418,
   30.0,
   3051.0357
  ],
  [
   1018.1418,
   30.0,
   3051.5357
  ],
  [
   1018.1418,
   30.0,
   3052.0357
  ],
  [
   1018.1418,
   30.0,
   3052.5357
  ],
  [
   1018.1418,
   30.0,
   3053.0357
  ],
  [
   1018.1418,
   30.0,
   3053.5357
  ],
  [
   1018.1418,
   30.0,
   3054.0357
  ],
  [
   1018.1418,
   30.0,
   3054.5357
  ],
  [
   1018.1418,
   30.0,
   3055.0357
  ],
  [
   1018.1418,
   30.0,
   3055.5357
  ],
  [
   1018.1418,
   30.0,
   3056.0357
  ],
  [
   1018.1418,
   30.0,
   3056.5357
  ],
  [
   1018.1418,
   30.0,
   3057.0357
  ],
  [
   1018.1418,
   30.0,
   3057.5357
  ],
  [
   1018.1418,
   30.0,
   3058.0357
  ],
  [
   1018.1418,
   30.0,
   3058.5357
  ],
  [
   1018.1418,
   30.0,
   3059.0357
  ],
  [
   1018.1418,
   30.0,
   3059.5357
  ],
  [
   1018.1418,
   30.0,
   3060.0357
  ],
  [
   1018.1418,
   30.0,
   3060.5357
  ],
  [
   1018.1418,
   30.0,
   3061.0357
  ],
  [
   1018.1418,
   30.0,
   3061.5357
  ],
  [
   1018.1418,
   30.0,
   3062.0357
  ],
  [
   1018.1418,
   30.0,
   3062.5357
  ]
 ],
 "maneuvers": [],
 "stops": [
  {
   "s_m": 68.000032,
   "kind": "route_end"
  }
 ],
 "length_m": 68.000032,
 "source": {
  "generator": "tests/fixtures/capture_dc2/make_synthetic.py",
  "synthetic": true
 },
 "description": "SYNTHETIC golden S-curve (DD-5-min fixture)"
}
